order_id,date,model,brand,release_year,price,region,customer_review,ram,storage,color
ORD1495,2024-01-27,Oppo A54,Oppo,2021,199,Europe,Mid-range with decent camera. ColorOS has improved over time.,4,128,Starry Black
ORD1496,2024-09-16,Honor 9X,Honor,2019,249,Oceania,Older phone with pop-up camera. EMUI features are comprehensive.,4,128,Sapphire Blue
ORD1497,2024-05-14,Realme 8,Realme,2021,199,South America,Good camera phone with fast charging. Realme UI has improved.,6,128,Cyber Black
ORD1498,2024-11-27,Motorola Moto G31,Motorola,2021,179,North America,Budget phone with clean Android. Performance is adequate.,4,128,Mineral Gray
ORD1499,2024-02-19,Galaxy M32,Samsung,2021,249,Asia,Mid-range with AMOLED display. One UI features are comprehensive.,6,128,Awesome Black
ORD1500,2024-08-03,iPhone X,Apple,2017,499,Africa,Revolutionary iPhone with Face ID. Design still feels modern.,3,64,Silver
ORD1501,2024-12-07,Galaxy S24,Samsung,2024,899,Europe,Latest Samsung flagship with AI features. One UI 6 is polished and camera quality excellent.,8,256,Phantom Black
ORD1502,2024-04-16,iPhone 15 Pro,Apple,2023,1199,Oceania,Pro iPhone with titanium build and Action Button. Camera system is outstanding.,8,512,Natural Titanium
ORD1503,2024-09-28,Pixel 8a,Google,2024,549,South America,Mid-range Pixel with flagship camera AI. Stock Android experience is smooth.,8,128,Bay
ORD1504,2024-06-11,OnePlus 12,OnePlus,2024,899,North America,Fast flagship with excellent display. OxygenOS 14 is clean and responsive.,12,256,Flowy Emerald
ORD1505,2024-01-23,Xiaomi 14,Xiaomi,2024,999,Asia,Flagship with Leica camera partnership. HyperOS is cleaner than MIUI.,12,512,White
ORD1506,2024-11-14,Vivo X100,Vivo,2024,899,Africa,Camera flagship with excellent zoom capabilities. Funtouch OS has improved significantly.,12,256,Asteroid Black
ORD1507,2024-07-19,Oppo Find X7,Oppo,2024,1099,Europe,Premium flagship with fast charging. ColorOS 14 is mature and responsive.,12,512,Ocean Blue
ORD1508,2024-03-02,Honor Magic 6 Pro,Honor,2024,1199,Oceania,AI-powered flagship with excellent camera. MagicOS 8 is smooth and feature-rich.,16,512,Epi Green
ORD1509,2024-10-25,Realme GT 5 Pro,Realme,2024,799,South America,Gaming flagship with excellent cooling. Realme UI 5 is more polished.,12,256,Sonic White
ORD1510,2024-05-08,Motorola Edge 50 Pro,Motorola,2024,699,North America,Premium Motorola with clean Android 14. Build quality is excellent.,8,256,Moonlight Pearl
ORD1511,2024-08-15,Galaxy Z Fold6,Samsung,2024,1999,Asia,Improved foldable with better cameras. One UI 6.1 optimization for foldables is excellent.,12,512,Silver Shadow
ORD1512,2024-12-30,iPhone 16,Apple,2024,899,Africa,Latest iPhone with Camera Control button. Performance and battery life improved.,8,256,Ultramarine
ORD1513,2024-02-14,Nothing Phone 2a,Nothing,2024,399,Europe,Affordable Nothing phone with unique design. Nothing OS 2.5 is clean.,8,128,Milk
ORD1514,2024-09-21,Poco F6 Pro,Xiaomi,2024,699,Oceania,Gaming phone with flagship performance. HyperOS optimization is good.,12,256,Black
ORD1515,2024-06-27,Galaxy A55,Samsung,2024,449,South America,Mid-range Samsung with premium design. One UI 6 features trickle down nicely.,8,128,Awesome Iceblue
ORD1516,2024-04-03,Redmi Note 13 Pro,Xiaomi,2024,349,North America,Budget flagship with excellent camera. HyperOS is cleaner than MIUI.,8,256,Midnight Black
ORD1517,2024-11-08,iPhone 15,Apple,2023,799,Asia,iPhone with USB-C and improved cameras. iOS 17 features work seamlessly.,6,128,Blue
ORD1518,2024-01-17,OnePlus 12R,OnePlus,2024,599,Africa,Flagship killer with excellent performance. OxygenOS 14 is smooth.,8,256,Cool Blue
ORD1519,2024-07-24,Vivo V30,Vivo,2024,599,Europe,Camera-focused phone with great selfies. Funtouch OS 14 is improved.,8,256,Peacock Green
ORD1520,2024-10-12,Pixel 8 Pro,Google,2023,999,Oceania,Pro Pixel with advanced AI features. Camera capabilities are exceptional.,12,512,Obsidian
ORD1521,2024-03-29,Honor 200 Pro,Honor,2024,699,South America,Portrait photography specialist with excellent camera. MagicOS 8 is responsive.,12,256,Moonlight White
ORD1522,2024-08-06,Realme 12 Pro,Realme,2024,399,North America,Mid-range with good camera and fast charging. Realme UI 5 is more refined.,8,128,Navigator Beige
ORD1523,2024-12-18,Motorola Razr 50,Motorola,2024,899,Asia,Flip phone with improved durability. Stock Android on foldable is refreshing.,8,256,Beach Sand
ORD1524,2024-05-15,Galaxy S24+,Samsung,2024,1099,Africa,Large Samsung flagship with excellent display. AI features are genuinely useful.,12,512,Marble Gray
ORD1525,2024-09-01,iPhone 16 Pro Max,Apple,2024,1299,Europe,Largest iPhone with incredible camera system. Build quality and performance are top-tier.,8,512,Desert Titanium
ORD1526,2024-02-08,Xiaomi 14 Ultra,Xiaomi,2024,1499,Oceania,Camera flagship with professional features. HyperOS optimization is excellent.,16,512,Black
ORD1527,2024-06-22,OnePlus Nord 4,OnePlus,2024,399,South America,Metal unibody mid-range with fast charging. OxygenOS 14 is clean.,8,128,Mercurial Silver
ORD1528,2024-11-26,Vivo X100 Pro,Vivo,2024,1199,North America,Pro camera phone with excellent zoom. Funtouch OS features are comprehensive.,16,512,Meteorite Black
ORD1529,2024-04-11,Oppo Reno 12 Pro,Oppo,2024,599,Asia,AI-powered camera phone with good performance. ColorOS 14 is mature.,12,256,Space Brown
ORD1530,2024-08-28,Honor Magic V3,Honor,2024,1999,Africa,Ultra-thin foldable with excellent build quality. MagicOS foldable optimization is impressive.,16,512,Reddish Brown
ORD1531,2024-01-05,Realme GT 6,Realme,2024,699,Europe,Gaming flagship with RGB lighting. Performance and cooling are excellent.,8,512,Fluid Silver
ORD1532,2024-07-13,Motorola Edge 50 Ultra,Motorola,2024,999,Oceania,Premium Motorola with flagship features. Stock Android 14 experience is clean.,12,512,Forest Gray
ORD1533,2024-10-07,Galaxy Z Flip6,Samsung,2024,1199,South America,Compact foldable with improved cover screen. One UI 6.1 optimization is excellent.,12,512,Silver Shadow
ORD1534,2024-03-21,iPhone 15 Pro Max,Apple,2023,1399,North America,Largest Pro iPhone with titanium build. Camera system and performance are outstanding.,8,1024,Blue Titanium
ORD1535,2024-12-04,Nothing Phone 3,Nothing,2024,699,Asia,Latest Nothing phone with enhanced Glyph interface. Nothing OS 3.0 is polished.,12,256,White
ORD1536,2024-05-30,Poco X6 Pro,Xiaomi,2024,449,Africa,Gaming mid-range with excellent performance. HyperOS gaming optimization is good.,8,256,Gray
ORD1537,2024-09-17,Galaxy A35,Samsung,2024,399,Europe,Mid-range Samsung with good camera. One UI 6 Core features are comprehensive.,6,128,Awesome Lilac
ORD1538,2024-02-26,Redmi Turbo 3,Xiaomi,2024,399,Oceania,Fast mid-range phone with gaming focus. HyperOS performance optimization is excellent.,8,256,Free Blue
ORD1539,2024-06-08,iPhone 14 Plus,Apple,2022,899,South America,Large iPhone with excellent battery life. iOS 16 features work seamlessly.,6,256,Purple
ORD1540,2024-11-21,OnePlus Open,OnePlus,2023,1699,North America,Foldable with excellent build quality. OxygenOS foldable optimization is impressive.,16,512,Emerald Dusk
ORD1541,2024-04-17,Vivo Y200,Vivo,2024,299,Asia,Budget phone with decent camera. Funtouch OS Lite is cleaner.,8,128,Desert Gold
ORD1542,2024-08-24,Pixel Fold,Google,2023,1799,Africa,Google's foldable with pure Android experience. Camera and multitasking capabilities are excellent.,12,256,Obsidian
ORD1543,2024-01-12,Honor 90 Lite,Honor,2023,299,Europe,Budget phone with good build quality. MagicOS Lite is simplified.,6,128,Cyan Lake
ORD1544,2024-07-05,Realme C67,Realme,2024,199,Oceania,Budget phone with decent performance. Realme UI Go is lighter.,6,128,Sunny Orange
ORD1545,2024-10-18,Motorola Moto G84,Motorola,2024,299,South America,Mid-range with clean Android 14. Performance is solid for the price.,8,256,Viva Magenta
ORD1546,2024-03-07,Galaxy M55,Samsung,2024,399,North America,Mid-range with large display. One UI 6 Core features are basic but functional.,8,128,Awesome Navy
ORD1547,2024-12-14,iPhone 13 Pro Max,Apple,2021,1099,Asia,Large Pro iPhone with excellent camera. Performance remains flagship-level.,6,512,Alpine Green
ORD1548,2024-05-23,Xiaomi Redmi 12,Xiaomi,2023,179,Africa,Budget phone with decent build quality. HyperOS Lite reduces bloatware.,4,128,Sky Blue
ORD1549,2024-09-10,OnePlus Nord CE 4,OnePlus,2024,329,Europe,Budget OnePlus with fast charging. OxygenOS 14 is clean and responsive.,8,128,Celadon Marble
ORD1550,2024-02-01,Vivo Y100,Vivo,2024,399,Oceania,Mid-range with good camera and design. Funtouch OS 14 is improved.,8,256,Metal Black
ORD1551,2024-06-17,Oppo A79,Oppo,2024,249,South America,Budget phone with decent camera. ColorOS 14 Lite is simplified.,8,128,Mystery Black
ORD1552,2024-11-05,Honor X50,Honor,2023,299,North America,Mid-range with good battery life. MagicOS 7 is smooth.,8,256,Emerald Green
ORD1553,2024-04-24,Realme 11,Realme,2023,299,Asia,Mid-range with good camera. Realme UI 4 has improved significantly.,8,128,Glory Gold
ORD1554,2024-08-12,Motorola Moto G54,Motorola,2024,199,Africa,Budget phone with clean Android 14. Performance is adequate for daily use.,4,128,Amethyst Purple
ORD1555,2024-01-29,Galaxy A25,Samsung,2024,299,Europe,Budget Samsung with One UI 6 features. Performance is basic but functional.,6,128,Awesome Blue
ORD1556,2024-07-16,iPhone 12 Pro Max,Apple,2020,999,Oceania,Large iPhone with excellent camera system. Performance remains strong.,6,256,Pacific Blue
ORD1557,2024-10-03,Poco M6 Pro,Xiaomi,2024,199,South America,Budget phone with large battery. HyperOS Lite is cleaner.,6,128,Forest Green
ORD1558,2024-03-18,OnePlus Nord N30,OnePlus,2023,299,North America,Budget OnePlus with decent performance. OxygenOS is smooth.,8,128,Chromatic Gray
ORD1559,2024-12-25,Vivo V29,Vivo,2023,499,Asia,Camera-focused phone with good selfies. Funtouch OS 13 is improved.,8,256,Noble Black
ORD1560,2024-05-06,Pixel 7a,Google,2023,499,Africa,Mid-range Pixel with flagship camera features. Stock Android experience is excellent.,8,128,Coral
ORD1561,2024-09-22,Honor Magic 5 Pro,Honor,2023,999,Europe,Flagship with excellent camera and AI features. MagicOS 7 is responsive.,12,512,Meadow Green
ORD1562,2024-02-13,Realme GT Neo 5,Realme,2023,599,Oceania,Gaming phone with fast charging. Performance is excellent for the price.,8,256,Electric Violet
ORD1563,2024-06-29,Motorola Edge 40 Pro,Motorola,2023,799,South America,Premium Motorola with flagship features. Stock Android 13 is clean.,12,256,Interstellar Black
ORD1564,2024-11-16,Galaxy S23 FE,Samsung,2023,699,North America,Fan Edition Samsung with flagship features. One UI 5.1 is polished.,8,256,Mint
ORD1565,2024-04-05,iPhone 14 Pro Max,Apple,2022,1299,Asia,Largest iPhone with Dynamic Island. Camera system is exceptional.,6,512,Space Black
ORD1566,2024-08-18,Xiaomi 13T,Xiaomi,2023,649,Africa,Mid-range flagship with good camera. MIUI 14 optimization is improved.,8,256,Meadow Green
ORD1567,2024-01-07,OnePlus 11R,OnePlus,2023,499,Europe,Flagship killer with excellent performance. OxygenOS 13 is smooth.,8,128,Galactic Silver
ORD1568,2024-07-26,Vivo X90,Vivo,2023,899,Oceania,Camera flagship with Zeiss partnership. Funtouch OS 13 is improved.,12,256,Asteroid Black
ORD1569,2024-10-14,Oppo Find N3,Oppo,2023,1699,South America,Foldable with excellent camera system. ColorOS foldable optimization is good.,16,512,Gold
ORD1570,2024-03-31,Honor 70,Honor,2022,599,North America,Mid-range with good camera and design. Magic UI 6 is responsive.,8,256,Emerald Green
ORD1571,2024-12-08,Realme GT 2 Pro,Realme,2022,749,Asia,Flagship with premium materials. Realme UI 3 has improved significantly.,12,256,Paper White
ORD1572,2024-05-19,Motorola Moto G73,Motorola,2023,299,Africa,Mid-range with clean Android 13. Performance is solid for the price.,8,256,Lucent White
ORD1573,2024-09-06,Galaxy A54,Samsung,2023,449,Europe,Mid-range Samsung with good camera. One UI 5.1 features are comprehensive.,8,128,Awesome Violet
ORD1574,2024-02-22,iPhone 13,Apple,2021,699,Oceania,Solid iPhone with excellent performance. Camera improvements are noticeable.,4,128,Starlight
ORD1575,2024-06-14,Poco F5 Pro,Xiaomi,2023,679,South America,Gaming flagship with excellent cooling. MIUI 14 optimization is good.,12,256,Knight Silver
ORD1576,2024-11-30,OnePlus Nord 3,OnePlus,2023,449,North America,Mid-range with flagship performance. OxygenOS 13 is clean and responsive.,8,128,Misty Green
ORD1577,2024-04-09,Vivo Y27,Vivo,2023,249,Asia,Budget phone with decent camera. Funtouch OS 13 Lite is simplified.,6,128,Garden Green
ORD1578,2024-08-25,Pixel 6 Pro,Google,2021,899,Africa,Pro Pixel with Tensor chip. Camera computational photography is excellent.,12,128,Stormy Black
ORD1579,2024-01-18,Honor Magic 4 Pro,Honor,2022,1099,Europe,Flagship with excellent camera system. Magic UI 6 is smooth and responsive.,8,256,Black
ORD1580,2024-07-07,Realme 10 Pro,Realme,2023,399,Oceania,Mid-range with good camera and fast charging. Realme UI 4 is more polished.,8,128,Hyperspace
ORD1581,2024-10-24,Motorola Edge 30 Ultra,Motorola,2022,899,South America,Flagship Motorola with excellent camera. Stock Android 12 is clean.,8,256,Starlight White
ORD1582,2024-03-14,Galaxy Z Fold5,Samsung,2023,1899,North America,Improved foldable with better multitasking. One UI 5.1 optimization is excellent.,12,512,Icy Blue
ORD1583,2024-12-21,iPhone 15 Plus,Apple,2023,999,Asia,Large iPhone with excellent battery life. USB-C adoption is welcome.,6,256,Green
ORD1584,2024-05-31,Xiaomi 13,Xiaomi,2023,799,Africa,Compact flagship with Leica cameras. MIUI 14 refinements are good.,8,256,White
ORD1585,2024-09-18,OnePlus 10 Pro,OnePlus,2022,899,Europe,Flagship with Hasselblad cameras. OxygenOS 12 is smooth.,8,128,Volcanic Black
ORD1586,2024-02-06,Vivo X80,Vivo,2022,999,Oceania,Camera flagship with excellent performance. Funtouch OS 12 is improved.,12,256,Cosmic Black
ORD1587,2024-06-23,Oppo Reno 10 Pro,Oppo,2023,649,South America,Camera phone with good portrait mode. ColorOS 13 is user-friendly.,12,256,Silvery Gray
ORD1588,2024-11-12,Honor Magic V2,Honor,2023,1999,North America,Ultra-thin foldable with premium build. MagicOS 7 foldable features are impressive.,16,512,Black
ORD1589,2024-04-28,Realme GT Neo 3,Realme,2022,549,Asia,Gaming phone with fast charging. Performance is excellent for the price.,8,128,Nitro Blue
ORD1590,2024-08-09,Motorola Moto G62,Motorola,2022,249,Africa,Budget phone with clean Android 12. Performance is adequate for daily use.,4,128,Frosted Blue
ORD1591,2024-01-26,Galaxy A73,Samsung,2022,549,Europe,Large Samsung mid-range with good camera. One UI 4 features are comprehensive.,8,256,Awesome Mint
ORD1592,2024-07-21,iPhone 11 Pro Max,Apple,2019,999,Oceania,Large iPhone with triple camera system. Performance remains excellent.,4,256,Midnight Green
ORD1593,2024-10-09,Poco X5 Pro,Xiaomi,2023,349,South America,Gaming mid-range with excellent performance. MIUI 14 optimization is good.,8,256,Astral Black
ORD1594,2024-03-25,OnePlus Nord 2,OnePlus,2021,399,North America,Mid-range with flagship performance. OxygenOS 11 is smooth.,8,128,Blue Haze
ORD1595,2024-12-16,Vivo V25 Pro,Vivo,2022,649,Asia,Camera-focused phone with color-changing back. Funtouch OS 12 is improved.,8,128,Sailing Blue
ORD1596,2024-05-12,Pixel 5,Google,2020,699,Africa,Compact Pixel with excellent camera. Stock Android experience is clean.,8,128,Sorta Sage
ORD1597,2024-09-29,Honor 50,Honor,2021,599,Europe,Mid-range with good camera and design. Magic UI 4.2 is responsive.,8,256,Emerald Green
ORD1598,2024-02-17,Realme 9 Pro+,Realme,2022,449,Oceania,Camera phone with good performance. Realme UI 3 has improved significantly.,8,128,Aurora Green
ORD1599,2024-06-04,Motorola Edge 20,Motorola,2021,699,South America,Premium Motorola with clean Android 11. Build quality is excellent.,8,128,Frosted Emerald
ORD1600,2024-11-23,Galaxy S22 Ultra,Samsung,2022,1199,North America,Large Samsung flagship with S Pen. One UI 4 is polished and feature-rich.,12,256,Phantom Black
ORD1601,2024-04-14,iPhone 16 Plus,Apple,2024,999,Asia,Large iPhone with Camera Control and improved battery. iOS 18 features are excellent.,8,256,Pink
ORD1602,2024-08-31,Pixel 9,Google,2024,799,Africa,Latest Pixel with Tensor G4 chip. AI features and camera quality are outstanding.,12,128,Peony
ORD1603,2024-01-09,OnePlus 13,OnePlus,2024,999,Europe,Latest flagship with Snapdragon 8 Elite. OxygenOS 15 is clean and responsive.,16,512,Arctic Dawn
ORD1604,2024-07-18,Xiaomi 15,Xiaomi,2024,899,Oceania,Flagship with improved cameras and performance. HyperOS 2.0 is refined.,12,256,Green
ORD1605,2024-10-06,Vivo X200,Vivo,2024,999,South America,Camera flagship with excellent zoom and AI features. OriginOS 5 is smooth.,16,512,Titanium Gray
ORD1606,2024-03-23,Oppo Find X8,Oppo,2024,1199,North America,Premium flagship with fast charging and cameras. ColorOS 15 is mature.,16,512,Space Black
ORD1607,2024-12-11,Honor Magic 7,Honor,2024,1099,Asia,AI-powered flagship with excellent performance. MagicOS 9 is feature-rich.,16,512,Lunar Shadow Silver
ORD1608,2024-05-28,Realme GT 7 Pro,Realme,2024,899,Africa,Gaming flagship with advanced cooling. Realme UI 6 is more polished than ever.,16,256,Mars Orange
ORD1609,2024-09-15,Motorola Edge 60,Motorola,2024,799,Europe,Premium Motorola with flagship features. Stock Android 15 experience is clean.,12,256,Nebula Blue
ORD1610,2024-02-02,Galaxy S25,Samsung,2025,1099,Oceania,Next-gen Samsung flagship with improved AI. One UI 7 brings major improvements.,12,256,Phantom Silver
ORD1611,2024-06-19,iPhone 16 Pro,Apple,2024,1199,South America,Pro iPhone with enhanced cameras and titanium build. Performance is exceptional.,8,512,White Titanium
ORD1612,2024-11-07,Nothing Phone 4,Nothing,2024,799,North America,Latest Nothing phone with enhanced Glyph interface. Nothing OS 4.0 is polished.,12,256,Black
ORD1613,2024-04-01,Poco F7,Xiaomi,2024,599,Asia,Gaming phone with flagship performance at mid-range price. HyperOS gaming optimization excellent.,12,256,Midnight Black
ORD1614,2024-08-17,Galaxy A75,Samsung,2024,549,Africa,Premium mid-range with flagship features. One UI 6.1 Core is comprehensive.,8,256,Awesome Blue
ORD1615,2024-01-14,Redmi Note 14 Pro,Xiaomi,2024,399,Europe,Budget flagship with excellent camera value. HyperOS optimization is impressive.,8,256,Twilight Purple
ORD1616,2024-07-03,iPhone 15 Pro Max,Apple,2023,1399,Oceania,Largest Pro iPhone with incredible camera system. Build quality is premium.,8,1024,Black Titanium
ORD1617,2024-10-20,OnePlus 13R,OnePlus,2024,699,South America,Flagship killer with excellent value proposition. OxygenOS 15 is smooth.,12,256,Astral Black
ORD1618,2024-03-08,Vivo V40,Vivo,2024,649,North America,Camera-focused phone with excellent selfies. OriginOS 4 is improved.,12,256,Ganges Blue
ORD1619,2024-12-26,Pixel 9 Pro,Google,2024,999,Asia,Pro Pixel with advanced AI and camera features. Pure Android experience exceptional.,16,512,Obsidian
ORD1620,2024-05-15,Honor 300 Pro,Honor,2024,799,Africa,Portrait photography specialist with AI features. MagicOS 9 is responsive.,12,256,Moonlight White
ORD1621,2024-09-02,Realme 13 Pro,Realme,2024,499,Europe,Mid-range with flagship camera features. Realme UI 6 improvements are significant.,8,256,Speed Green
ORD1622,2024-02-28,Motorola Razr 60,Motorola,2024,1199,Oceania,Flip phone with improved durability and features. Stock Android on foldable refreshing.,12,512,Viva Magenta
ORD1623,2024-06-11,Galaxy Z Fold7,Samsung,2025,2199,South America,Next-gen foldable with enhanced AI features. One UI 7 foldable optimization excellent.,16,1024,Phantom Blue
ORD1624,2024-11-28,iPhone 17,Apple,2025,1199,North America,Future iPhone with revolutionary features. iOS 19 capabilities are groundbreaking.,12,512,Space Black
ORD1625,2024-04-25,Xiaomi 16,Xiaomi,2025,1099,Asia,Next-gen flagship with advanced AI capabilities. HyperOS 3.0 is revolutionary.,16,512,Ceramic White
ORD1626,2024-08-12,OnePlus 14,OnePlus,2025,1199,Africa,Future flagship with cutting-edge technology. OxygenOS 16 brings major innovations.,16,1024,Glacial Green
ORD1627,2024-01-30,Vivo X300,Vivo,2025,1299,Europe,Advanced camera flagship with AI photography. OriginOS 6 is feature-rich.,20,1024,Cosmic Black
ORD1628,2024-07-16,Oppo Find X9,Oppo,2025,1399,Oceania,Premium flagship with revolutionary charging. ColorOS 16 is mature and refined.,16,1024,Aurora Silver
ORD1629,2024-10-28,Honor Magic 8,Honor,2025,1299,South America,AI-powered flagship with advanced features. MagicOS 10 capabilities are impressive.,20,512,Mystic Bronze
ORD1630,2024-03-19,Realme GT 8 Pro,Realme,2025,999,North America,Gaming flagship with next-gen cooling. Realme UI 7 optimization is exceptional.,16,512,Phantom Silver
ORD1631,2024-12-05,Motorola Edge 70,Motorola,2025,899,Asia,Premium phone with advanced AI features. Stock Android 16 experience is clean.,16,256,Cosmic Blue
ORD1632,2024-05-22,Galaxy S26,Samsung,2026,1299,Africa,Revolutionary Samsung with AI integration. One UI 8 brings major improvements.,16,512,Phantom Gold
ORD1633,2024-09-08,iPhone 17 Pro,Apple,2025,1399,Europe,Pro iPhone with enhanced capabilities. Camera system is revolutionary.,12,1024,Titanium Green
ORD1634,2024-02-15,Nothing Phone 5,Nothing,2025,899,Oceania,Advanced Nothing phone with evolved Glyph. Nothing OS 5.0 is sophisticated.,16,512,Transparent
ORD1635,2024-06-26,Poco F8,Xiaomi,2025,699,South America,Gaming phone with flagship performance. HyperOS gaming features are advanced.,16,256,Electric Blue
ORD1636,2024-11-14,Galaxy A85,Samsung,2025,649,North America,Premium mid-range with AI features. One UI 7 Core is comprehensive.,12,256,Awesome Purple
ORD1637,2024-04-07,Redmi Note 15 Pro,Xiaomi,2025,449,Asia,Budget flagship with AI capabilities. HyperOS optimization is excellent.,12,256,Gradient Blue
ORD1638,2024-08-24,iPhone 16 Pro Max,Apple,2024,1399,Africa,Largest iPhone with Camera Control. Performance and camera are exceptional.,8,1024,Natural Titanium
ORD1639,2024-01-21,OnePlus 13 Pro,OnePlus,2024,1199,Europe,Pro flagship with advanced features. OxygenOS 15 Pro is refined.,16,1024,Midnight Black
ORD1640,2024-07-09,Vivo V50,Vivo,2025,749,Oceania,Camera phone with AI photography. OriginOS 5 improvements are significant.,12,256,Sunset Gold
ORD1641,2024-10-15,Pixel 10,Google,2025,899,South America,Next-gen Pixel with Tensor G5 chip. AI capabilities are groundbreaking.,16,256,Storm Blue
ORD1642,2024-03-02,Honor 400 Pro,Honor,2025,899,North America,Advanced portrait phone with AI features. MagicOS 10 is responsive.,16,512,Pearl White
ORD1643,2024-12-19,Realme 14 Pro,Realme,2025,599,Asia,Mid-range with flagship camera AI. Realme UI 7 refinements are impressive.,12,256,Space Silver
ORD1644,2024-05-06,Motorola Razr 70,Motorola,2025,1299,Africa,Advanced flip phone with AI features. Stock Android foldable experience excellent.,16,512,Rose Gold
ORD1645,2024-09-23,Galaxy Z Fold8,Samsung,2026,2399,Europe,Revolutionary foldable with AI integration. One UI 8 foldable optimization outstanding.,20,1024,Phantom Silver
ORD1646,2024-02-11,iPhone 17 Plus,Apple,2025,1299,Oceania,Large iPhone with advanced capabilities. Battery life and performance exceptional.,12,1024,Blue Titanium
ORD1647,2024-06-18,Xiaomi 17,Xiaomi,2026,1199,South America,Future flagship with AI photography. HyperOS 4.0 capabilities are advanced.,20,1024,Mystic Black
ORD1648,2024-11-05,OnePlus 15,OnePlus,2026,1299,North America,Next-gen flagship with cutting-edge tech. OxygenOS 17 innovations are impressive.,20,1024,Arctic Silver
ORD1649,2024-04-22,Vivo X400,Vivo,2026,1399,Asia,Advanced camera flagship with AI. OriginOS 7 features are comprehensive.,24,1024,Cosmic Purple
ORD1650,2024-08-08,Oppo Find X10,Oppo,2026,1499,Africa,Premium flagship with revolutionary features. ColorOS 17 maturity is evident.,20,1024,Space Gold
ORD1651,2024-01-27,Honor Magic 9,Honor,2026,1399,Europe,AI-powered flagship with advanced capabilities. MagicOS 11 is feature-rich.,20,1024,Lunar Silver
ORD1652,2024-07-14,Realme GT 9 Pro,Realme,2026,1099,Oceania,Gaming flagship with next-gen performance. Realme UI 8 optimization excellent.,20,512,Phantom Black
ORD1653,2024-10-31,Motorola Edge 80,Motorola,2026,999,South America,Premium phone with AI integration. Stock Android 17 experience is clean.,20,512,Nebula Green
ORD1654,2024-03-16,Galaxy S27,Samsung,2027,1399,North America,Revolutionary Samsung with advanced AI. One UI 9 brings major innovations.,20,1024,Phantom Diamond
ORD1655,2024-12-02,iPhone 18,Apple,2026,1299,Asia,Future iPhone with groundbreaking features. iOS 20 capabilities are revolutionary.,16,1024,Titanium White
ORD1656,2024-05-30,Nothing Phone 6,Nothing,2026,999,Africa,Advanced Nothing phone with evolved design. Nothing OS 6.0 is sophisticated.,20,512,Crystal Clear
ORD1657,2024-09-16,Poco F9,Xiaomi,2026,799,Europe,Gaming phone with flagship performance. HyperOS gaming optimization is advanced.,20,512,Electric Green
ORD1658,2024-02-07,Galaxy A95,Samsung,2026,749,Oceania,Premium mid-range with AI capabilities. One UI 8 Core is comprehensive.,16,512,Awesome Gold
ORD1659,2024-06-25,Redmi Note 16 Pro,Xiaomi,2026,549,South America,Budget flagship with AI features. HyperOS optimization is exceptional.,16,256,Cosmic Blue
ORD1660,2024-11-12,iPhone 17 Pro Max,Apple,2025,1599,North America,Largest Pro iPhone with revolutionary camera. Build quality and performance outstanding.,12,2048,Black Titanium
ORD1661,2024-04-04,OnePlus 14 Pro,OnePlus,2025,1399,Asia,Pro flagship with advanced AI features. OxygenOS 16 Pro refinements impressive.,20,1024,Glacial Blue
ORD1662,2024-08-21,Vivo V60,Vivo,2026,849,Africa,Camera phone with AI photography advances. OriginOS 6 improvements significant.,16,512,Aurora Pink
ORD1663,2024-01-13,Pixel 10 Pro,Google,2025,1099,Europe,Pro Pixel with Tensor G5 capabilities. AI photography features groundbreaking.,20,1024,Obsidian Black
ORD1664,2024-07-28,Honor 500 Pro,Honor,2026,999,Oceania,Advanced portrait phone with AI. MagicOS 11 responsiveness excellent.,20,512,Moonlight Silver
