order_id,date,model,brand,release_year,price,region,customer_review,ram,storage,color
ORD1338,2024-02-17,12T,Xiaomi,2022,999,North America,Flagship with premium materials and good camera. MIUI refinements are good and performance is solid.,8,512,Midnight Silver
ORD1339,2024-07-25,Reno 10 Pro,Oppo,2023,749,Africa,Excellent portrait photography with fast charging capabilities. ColorOS is user-friendly and camera quality is impressive.,8,512,Starlight Blue
ORD1340,2024-05-13,Magic 5 Pro,Honor,2023,1199,South America,Premium flagship with AI features and excellent camera. Magic OS learning curve exists but features are useful.,12,512,Knight Black
ORD1341,2024-12-28,Y27,Vivo,2023,549,Asia,Mid-range with good camera and stylish design. FunTouch OS has improved and performance is adequate.,8,256,Cosmic Gold
ORD1342,2024-08-09,Pixel Fold,Google,2023,1999,Europe,Google's refined foldable with pure Android experience. Expensive but multitasking capabilities are genuinely impressive.,12,512,Obsidian
ORD1343,2024-06-14,GT Neo5,Realme,2023,479,Oceania,Gaming-focused with good cooling and performance. Design is attractive and price-to-performance ratio is excellent.,6,256,Neon Blue
ORD1344,2024-03-31,Nova 11,Huawei,2023,799,North America,Good camera and premium build quality throughout. HarmonyOS ecosystem growing but Google absence still problematic.,8,512,Space Purple
ORD1345,2024-09-18,iPhone 14,Apple,2022,699,Africa,Reliable design with modern internals and features. Performance is excellent and iOS experience is smooth.,6,256,Product Blue
ORD1346,2024-07-06,Magic Vs,Honor,2022,1999,South America,Premium foldable with excellent build and performance. MagicOS optimization for foldables is impressive.,16,512,Golden Black
ORD1347,2024-10-24,Find X6,Oppo,2023,1299,Asia,Top-tier flagship with fast charging and camera. ColorOS has matured significantly and performance is excellent.,12,512,Cosmic Silver
ORD1348,2024-01-11,Edge 40,Motorola,2023,949,Europe,Premium Motorola with flagship features and build. Stock Android experience is clean and performance is solid.,12,512,Eclipse Gray
ORD1349,2024-08-27,Galaxy Z Flip5,Samsung,2023,999,Oceania,Stylish foldable with improved durability and features. Cover screen functionality expanded and build quality is excellent.,8,512,Phantom Gold
ORD1350,2024-05-18,Poco F5 Pro,Xiaomi,2023,949,North America,High-performance gaming phone with excellent cooling system. POCO UI is clean and gaming performance is outstanding.,8,512,Electric Blue
ORD1351,2024-11-25,V25,Vivo,2022,849,Africa,Camera flagship with impressive zoom and selfie capabilities. Performance is flagship-level and software experience is good.,12,512,Professional Black
ORD1352,2024-04-02,GT 5,Realme,2023,899,South America,Fast charging and excellent gaming performance. Realme UI improvements are noticeable and build quality is solid.,8,512,Lightning Blue
ORD1353,2024-07-09,Mate 50,Huawei,2022,1699,Asia,Flagship with exceptional camera and build quality. HarmonyOS ecosystem continues growing but limitations persist.,16,512,Space Black
ORD1354,2024-09-14,Galaxy S23 Ultra,Samsung,2023,1199,Europe,Latest Samsung flagship with improved camera AI features. One UI 5 is polished and S Pen functionality is excellent.,12,512,Phantom Green
ORD1355,2024-12-20,iPhone 15,Apple,2023,1199,Oceania,Next generation iPhone with enhanced efficiency and camera. iOS 17 features are excellent and performance is outstanding.,8,512,Blue
ORD1356,2024-06-25,Edge 30 Ultra,Motorola,2022,1199,North America,Premium Motorola with flagship features throughout. Stock Android purity refreshing and build quality is excellent.,12,512,Carbon Black
ORD1357,2024-10-08,Nova 10,Huawei,2022,899,South America,Good camera system with premium design and feel. Google services limitation remains major concern for users.,8,512,Aurora Purple
ORD1358,2024-02-21,GT Neo3,Realme,2022,899,Africa,Gaming flagship with RGB lighting and advanced cooling. Performance excellent and design is eye-catching.,12,512,Cyber Red
ORD1359,2024-09-13,Magic V,Honor,2021,2099,Asia,Premium foldable with excellent multitasking capabilities. MagicOS optimization for foldables genuinely impressive.,16,512,Golden Silver
ORD1360,2024-07-17,iPhone 14 Plus,Apple,2022,1399,Europe,Large iPhone with excellent battery and camera performance. iOS ecosystem integration seamless and performance is excellent.,8,512,Purple
ORD1361,2024-05-26,Y21,Vivo,2021,649,Oceania,Mid-range with good camera and attractive design. FunTouch OS improved and performance is adequate for daily use.,8,256,Cosmic Purple
ORD1362,2024-08-31,Pixel 7 Pro,Google,2022,1299,North America,Computational photography excellence with pure Android experience. Battery optimization improved and camera quality is exceptional.,12,512,Cloudy White
ORD1363,2024-11-07,11T,Xiaomi,2021,1099,Africa,Flagship performance with good camera and materials. MIUI refinements good and overall experience is solid.,8,512,Midnight Blue
ORD1364,2024-03-16,Edge 30,Motorola,2022,1049,South America,Premium Motorola with flagship features and performance. Stock Android experience clean and camera quality is decent.,12,512,Eclipse Silver
ORD1365,2024-12-04,Reno 8 Pro,Oppo,2022,849,Asia,Excellent portrait photography with fast charging capabilities. ColorOS user-friendly and camera performance is impressive.,8,512,Starlight Silver
ORD1366,2024-06-09,Galaxy A53,Samsung,2022,549,Europe,Reliable Samsung with One UI features and performance. Performance decent and camera quality is good for the price.,6,256,Awesome Purple
ORD1367,2024-08-15,C51,Realme,2021,429,Oceania,Good budget option with decent performance throughout. Build quality acceptable and software experience is adequate.,4,256,Dynamic Green
ORD1368,2024-01-28,Find X5,Oppo,2022,1399,North America,Flagship with premium build and fast charging. ColorOS maturity evident and performance is excellent.,12,512,Cosmic Gold
ORD1369,2024-10-05,Magic 4,Honor,2022,1299,Africa,Excellent flagship with AI features and camera system. Magic OS learning curve exists but features genuinely useful.,12,512,Knight Silver
ORD1370,2024-04-19,iPhone 13 Pro,Apple,2021,1499,South America,Pro iPhone with incredible camera and build quality. iOS 15 features excellent and premium build quality is outstanding.,12,512,Alpine Green
ORD1371,2024-07-31,V23,Vivo,2022,999,Asia,Camera flagship with impressive zoom and portrait capabilities. Performance flagship-level and software experience is clean.,12,512,Professional Gold
ORD1372,2024-09-06,Poco F4 GT,Xiaomi,2022,1049,Europe,Gaming phone with excellent cooling and performance throughout. POCO branding feels budget but specs are flagship-level.,8,512,Racing Black
ORD1373,2024-11-22,Galaxy S22+,Samsung,2022,1399,Oceania,Large flagship with excellent display and camera quality. One UI 4 feature-rich and performance is excellent.,12,512,Phantom Blue
ORD1374,2024-05-08,GT 2 Pro,Realme,2022,999,North America,Fast charging flagship with good gaming performance. Realme UI polish improved significantly over previous versions.,8,512,Thunder Blue
ORD1375,2024-09-29,Mate 40 Pro,Huawei,2020,1799,Africa,Premium flagship with exceptional camera system throughout. HarmonyOS ecosystem continues growing but Google absence hurts.,16,512,Titanium Black
ORD1376,2024-07-12,Edge 20,Motorola,2021,1699,South America,Premium phone with clean Android experience. Stock OS on display great and camera quality is decent.,12,512,Carbon Silver
ORD1377,2024-12-16,Nova 9,Huawei,2021,949,Asia,Good camera and premium build quality feel. HarmonyOS smooth but app availability remains significantly limited.,8,512,Pearl Blue
ORD1378,2024-03-05,GT Master,Realme,2021,999,Europe,Gaming flagship with good cooling and advanced features. Performance excellent and design is attractive.,12,512,Cyber Blue
ORD1379,2024-08-22,Magic V,Honor,2021,2199,Oceania,Premium foldable with excellent multitasking and build. MagicOS optimization for foldables impressive and refined.,16,512,Golden Black
ORD1380,2024-06-16,iPhone 13 Pro Max,Apple,2021,1699,North America,Top-tier iPhone with incredible camera and performance. iOS ecosystem integration seamless and camera quality is exceptional.,12,512,Sierra Blue
ORD1381,2024-10-30,Y52,Vivo,2021,749,Africa,Mid-range with good camera and stylish overall design. FunTouch OS improved and performance is adequate for daily tasks.,8,256,Cosmic Gold
ORD1382,2024-02-12,Pixel 6 Pro,Google,2021,2099,South America,Google's refined flagship with pure Android throughout. Expensive but camera capabilities genuinely impressive and useful.,12,512,Stormy Black
ORD1383,2024-07-18,GT Neo2,Realme,2021,579,Asia,Gaming-focused with good cooling and solid performance. Design attractive and price-to-performance ratio is excellent.,6,256,Neon Green
ORD1384,2024-08-03,Nova 8,Huawei,2021,1049,Europe,Good camera and premium build quality throughout. HarmonyOS ecosystem growing but Google services absence problematic.,8,512,Space Silver
ORD1385,2024-11-14,iPhone 12,Apple,2020,749,Oceania,Reliable design with modern internals and good performance. 5G connectivity excellent and iOS experience is smooth.,6,256,Pacific Blue
ORD1386,2024-05-01,Magic 3,Honor,2021,2299,North America,Premium flagship with excellent build and multitasking performance. MagicOS optimization genuinely impressive.,12,512,Space Gold
ORD1387,2024-09-08,Find X3,Oppo,2021,1499,Africa,Top-tier flagship with fast charging and excellent camera. ColorOS matured significantly and performance is outstanding.,12,512,Cosmic Silver
ORD1388,2024-01-24,Edge 20 Pro,Motorola,2021,1149,South America,Premium Motorola with flagship features and solid build. Stock Android experience clean and performance is excellent.,12,512,Eclipse Gray
ORD1389,2024-06-11,Galaxy Z Flip3,Samsung,2021,1099,Asia,Stylish foldable with improved durability and expanded features. Cover screen functionality excellent and build quality is solid.,8,512,Phantom Gold
ORD1390,2024-09-27,Poco F3,Xiaomi,2021,1149,Europe,High-performance gaming phone with excellent cooling throughout. POCO UI clean and gaming performance is outstanding.,8,512,Electric Green
ORD1391,2024-08-14,V21,Vivo,2021,1099,Oceania,Camera flagship with impressive zoom and selfie capabilities. Performance flagship-level and software experience is good.,12,512,Professional Blue
ORD1392,2024-04-10,GT,Realme,2021,1099,North America,Fast charging and excellent gaming performance throughout. Realme UI improvements noticeable and build quality is solid.,8,512,Lightning Yellow
ORD1393,2024-12-07,Mate 40,Huawei,2020,1999,Africa,Flagship with exceptional camera and premium build quality. HarmonyOS ecosystem continues growing but limitations persist significantly.,16,512,Space Black
ORD1394,2024-07-21,Galaxy S21 Ultra,Samsung,2021,1299,South America,Latest Samsung flagship with improved camera throughout. One UI 3 polished and S Pen functionality is excellent.,12,512,Phantom Black
ORD1395,2024-10-17,iPhone 12 Pro,Apple,2020,1299,Asia,Pro iPhone with enhanced camera and build quality. iOS 14 features excellent and camera performance is outstanding.,12,512,Graphite
ORD1396,2024-06-04,Edge 20 Ultra,Motorola,2021,1299,Europe,Premium Motorola with flagship features and performance throughout. Stock Android purity refreshing and camera quality is good.,12,512,Carbon Black
ORD1397,2024-09-21,Nova 7,Huawei,2020,1149,Oceania,Good camera system with premium design and build feel. Google services limitation remains major concern for most users.,8,512,Aurora Purple
ORD1398,2024-03-14,GT Master Edition,Realme,2021,1099,North America,Gaming flagship with advanced cooling system. Performance excellent and design is eye-catching.,12,512,Cyber Silver
ORD1399,2024-11-28,Magic 2,Honor,2018,2399,Africa,Premium phone with excellent build capabilities. Magic UI optimization impressive and refined throughout.,8,512,Golden Silver
ORD1400,2024-08-15,iPhone 12 Pro Max,Apple,2020,1599,South America,Large iPhone with excellent battery and camera performance throughout. iOS ecosystem integration seamless and performance is outstanding.,12,512,Pacific Blue
ORD1401,2024-07-12,Galaxy S23,Samsung,2023,999,North America,Solid flagship with excellent camera and display. One UI 5 is refined but battery could be better.,8,256,Phantom Black
ORD1402,2024-03-18,Pixel 7a,Google,2023,549,Europe,Great mid-range Pixel with excellent camera AI. Stock Android experience is smooth and updates are timely.,8,128,Sea
ORD1403,2024-11-25,iPhone 14,Apple,2022,899,Asia,Reliable iPhone with good performance. Camera upgrades are noticeable and iOS 16 features work well.,6,256,Midnight
ORD1404,2024-09-14,Redmi Note 12 Pro,Xiaomi,2023,349,Africa,Excellent value phone with fast charging. MIUI has ads but performance is surprisingly good.,8,256,Graphite Gray
ORD1405,2024-05-03,OnePlus 11,OnePlus,2023,799,Oceania,Fast flagship with excellent gaming performance. OxygenOS is clean and charging speed is incredible.,8,256,Titan Black
ORD1406,2024-01-20,Vivo V27,Vivo,2023,599,South America,Camera-focused phone with great selfie quality. FunTouch OS has improved significantly.,8,256,Noble Black
ORD1407,2024-08-07,Nothing Phone 2,Nothing,2023,699,Europe,Unique design with great build quality. Nothing OS is clean but camera needs improvement.,8,256,Dark Gray
ORD1408,2024-06-16,Galaxy A54,Samsung,2023,449,North America,Good mid-range Samsung with solid performance. One UI features trickle down nicely.,6,128,Awesome Violet
ORD1409,2024-12-01,iPhone 15,Apple,2023,999,Asia,Latest iPhone with USB-C finally. Camera improvements are solid and performance is excellent.,8,256,Pink
ORD1410,2024-04-28,Poco F5,Xiaomi,2023,449,Africa,Gaming phone with excellent cooling. Performance per dollar is outstanding.,8,256,Electric Blue
ORD1411,2024-10-11,Oppo Find X6,Oppo,2023,899,Europe,Premium flagship with fast charging. ColorOS has matured and camera quality is excellent.,12,512,Gold
ORD1412,2024-02-14,Honor 90,Honor,2023,599,Oceania,Good camera phone with premium design. Magic OS is improving and performance is solid.,8,256,Emerald Green
ORD1413,2024-07-30,Realme GT 3,Realme,2023,699,South America,Fast charging monster with good gaming performance. Realme UI needs more polish.,8,256,Booster Black
ORD1414,2024-09-22,Motorola Edge 40,Motorola,2023,649,North America,Clean Android experience with premium build. Camera could be better for the price.,8,256,Lunar Blue
ORD1415,2024-01-08,Galaxy S23+,Samsung,2023,1199,Asia,Large Samsung flagship with excellent display. Performance is top-tier but price is steep.,8,512,Cream
ORD1416,2024-05-17,iPhone 13,Apple,2021,699,Africa,Still excellent iPhone with great camera. iOS updates keep it feeling fresh.,6,256,Blue
ORD1417,2024-08-25,Pixel 8,Google,2023,799,Europe,Latest Pixel with improved AI features. Camera computational photography is outstanding.,8,256,Hazel
ORD1418,2024-11-09,Redmi 12,Xiaomi,2023,199,Oceania,Budget phone with decent performance. MIUI Lite is cleaner than regular MIUI.,4,128,Midnight Black
ORD1419,2024-03-26,OnePlus Nord 3,OnePlus,2023,399,South America,Good mid-range OnePlus with fast charging. OxygenOS is clean and performance is solid.,8,128,Misty Green
ORD1420,2024-06-12,Vivo Y36,Vivo,2023,299,North America,Budget phone with stylish design. Performance is adequate for basic tasks.,4,128,Vibrant Gold
ORD1421,2024-09-05,Nothing Phone 2a,Nothing,2024,349,Asia,More affordable Nothing phone with unique design. Performance is good for the price.,6,128,Milk
ORD1422,2024-12-18,Galaxy A34,Samsung,2023,399,Africa,Reliable Samsung mid-range with One UI. Camera is decent and battery life is good.,6,128,Awesome Silver
ORD1423,2024-04-15,iPhone SE 3,Apple,2022,429,Europe,Compact iPhone with modern internals. Battery life improved but screen feels small.,4,128,Starlight
ORD1424,2024-07-03,Poco X5 Pro,Xiaomi,2023,299,Oceania,Great value gaming phone. Performance exceeds expectations for the price.,6,128,Yellow
ORD1425,2024-10-27,Oppo A98,Oppo,2023,349,South America,Mid-range with good camera and fast charging. ColorOS is feature-rich.,6,128,Cool Black
ORD1426,2024-01-31,Honor X9a,Honor,2023,349,North America,Durable phone with good battery life. Magic OS has improved significantly.,8,256,Titanium Silver
ORD1427,2024-08-19,Realme 11 Pro,Realme,2023,399,Asia,Good camera phone with premium feel. Fast charging is excellent.,8,256,Sunrise Beige
ORD1428,2024-05-24,Motorola Moto G73,Motorola,2023,249,Africa,Clean Android experience at budget price. Performance is adequate for daily use.,8,128,Lucent White
ORD1429,2024-11-16,Galaxy Z Flip5,Samsung,2023,1099,Europe,Improved foldable with better cover screen. Durability has improved significantly.,8,512,Mint
ORD1430,2024-02-07,iPhone 14 Pro,Apple,2022,1199,Oceania,Pro iPhone with Dynamic Island. Camera system is exceptional.,6,256,Deep Purple
ORD1431,2024-09-28,Pixel 7,Google,2022,699,South America,Solid Pixel with great camera AI. Stock Android experience is clean.,8,128,Lemongrass
ORD1432,2024-06-21,Redmi Note 12,Xiaomi,2023,249,North America,Budget phone with surprising quality. MIUI ads are present but manageable.,4,128,Ice Blue
ORD1433,2024-04-03,OnePlus 10T,OnePlus,2022,649,Asia,Fast flagship with incredible charging speed. OxygenOS is smooth.,8,256,Moonstone Black
ORD1434,2024-12-10,Vivo V25,Vivo,2022,499,Africa,Camera-centric phone with good selfie quality. Design is premium feeling.,8,256,Diamond Black
ORD1435,2024-07-17,Nothing Ear 2,Nothing,2023,149,Europe,Good earbuds with unique design. Sound quality is solid for the price.,0,0,White
ORD1436,2024-10-04,Galaxy S22,Samsung,2022,799,Oceania,Compact flagship with excellent camera. One UI 4 is polished.,8,256,Phantom White
ORD1437,2024-01-22,iPhone 13 Pro,Apple,2021,1099,South America,Pro iPhone with incredible camera system. Build quality is exceptional.,6,512,Sierra Blue
ORD1438,2024-08-13,Poco F4,Xiaomi,2022,399,North America,Gaming phone with excellent cooling. Performance per dollar is outstanding.,6,128,Night Black
ORD1439,2024-05-29,Oppo Reno 8,Oppo,2022,599,Asia,Good camera phone with fast charging. ColorOS has improved significantly.,8,256,Starlight Gold
ORD1440,2024-11-03,Honor Magic 5,Honor,2023,799,Africa,Flagship with excellent camera and AI features. Magic OS is responsive.,12,512,Meadow Green
ORD1441,2024-03-11,Realme GT Neo 3,Realme,2022,449,Europe,Fast charging phone with good gaming performance. Design is eye-catching.,8,256,Nitro Blue
ORD1442,2024-07-26,Motorola Edge 30,Motorola,2022,549,Oceania,Premium Motorola with clean Android. Build quality is excellent.,8,256,Meteor Gray
ORD1443,2024-09-12,Galaxy A73,Samsung,2022,549,South America,Large Samsung mid-range with good camera. One UI features are comprehensive.,8,256,Awesome White
ORD1444,2024-12-25,iPhone 12,Apple,2020,599,North America,Still solid iPhone with 5G support. Camera quality remains excellent.,4,128,Green
ORD1445,2024-04-18,Pixel 6a,Google,2022,449,Asia,Great mid-range Pixel with Tensor chip. Camera AI is impressive.,6,128,Chalk
ORD1446,2024-08-01,Redmi K60,Xiaomi,2023,599,Africa,Flagship killer with excellent performance. MIUI optimization has improved.,12,256,White
ORD1447,2024-06-07,OnePlus Nord CE 3,OnePlus,2023,329,Europe,Good mid-range OnePlus with fast charging. OxygenOS is clean.,8,128,Aqua Surge
ORD1448,2024-10-19,Vivo Y02,Vivo,2022,149,Oceania,Basic smartphone with decent build quality. Performance is adequate for light use.,3,32,Orchid Blue
ORD1449,2024-01-15,Nothing Phone 1,Nothing,2022,499,South America,Unique transparent design with Glyph interface. Nothing OS is clean.,8,128,White
ORD1450,2024-09-07,Galaxy S21,Samsung,2021,699,North America,Solid Samsung flagship with good camera. One UI 3 is polished.,8,128,Phantom Gray
ORD1451,2024-05-12,iPhone 11,Apple,2019,499,Asia,Still excellent iPhone with great camera. Performance remains strong.,4,128,Purple
ORD1452,2024-11-24,Poco M5,Xiaomi,2022,179,Africa,Budget phone with large battery. MIUI Lite is cleaner than regular MIUI.,4,64,Icy Blue
ORD1453,2024-02-28,Oppo A77,Oppo,2022,299,Europe,Mid-range with good battery life. ColorOS is user-friendly.,6,128,Sky Blue
ORD1454,2024-08-11,Honor X8,Honor,2022,249,Oceania,Budget phone with decent camera. Magic UI has improved significantly.,6,128,Titanium Silver
ORD1455,2024-06-24,Realme 9 Pro,Realme,2022,329,South America,Good camera phone with fast charging. Realme UI needs more polish.,8,128,Sunset Orange
ORD1456,2024-04-06,Motorola Moto G52,Motorola,2022,219,North America,Clean Android experience at budget price. Performance is adequate.,4,128,Charcoal Gray
ORD1457,2024-12-15,Galaxy Z Fold4,Samsung,2022,1899,Asia,Excellent foldable with improved durability. Multitasking capabilities are outstanding.,12,512,Graygreen
ORD1458,2024-07-08,iPhone 13 mini,Apple,2021,699,Africa,Compact iPhone with flagship performance. Battery life improved over iPhone 12 mini.,4,128,Pink
ORD1459,2024-10-25,Pixel 6,Google,2021,599,Europe,First Pixel with Tensor chip. Camera computational photography is excellent.,8,128,Sorta Seafoam
ORD1460,2024-01-03,Redmi Note 11,Xiaomi,2022,199,Oceania,Budget phone with good display. MIUI has improved but ads remain.,4,64,Graphite Gray
ORD1461,2024-09-19,OnePlus 9,OnePlus,2021,729,South America,Flagship with Hasselblad camera partnership. OxygenOS is smooth.,8,128,Winter Mist
ORD1462,2024-05-07,Vivo V23,Vivo,2022,399,North America,Camera-focused phone with color-changing back. FunTouch OS is improving.,8,128,Stardust Black
ORD1463,2024-08-23,Nothing CMF Phone 1,Nothing,2024,199,Asia,Budget Nothing phone with modular design. Performance is good for the price.,6,128,Black
ORD1464,2024-11-11,Galaxy A24,Samsung,2023,249,Africa,Budget Samsung with One UI features. Performance is adequate for basic tasks.,4,128,Awesome Black
ORD1465,2024-03-17,iPhone XR,Apple,2018,399,Europe,Still solid iPhone with great battery life. LCD display is decent.,3,64,Black
ORD1466,2024-07-04,Poco C55,Xiaomi,2023,129,Oceania,Ultra-budget phone with basic features. Performance is limited but functional.,4,64,Cool Blue
ORD1467,2024-12-02,Oppo A58,Oppo,2023,199,South America,Budget phone with decent camera. ColorOS Lite is cleaner.,4,128,Glowing Black
ORD1468,2024-04-21,Honor Play 6T,Honor,2022,179,North America,Basic smartphone with good battery life. Magic UI Core is simplified.,4,64,Midnight Black
ORD1469,2024-08-16,Realme C55,Realme,2023,149,Asia,Budget phone with decent build quality. Realme UI Go is lighter.,4,64,Rainy Night
ORD1470,2024-06-13,Motorola Moto E13,Motorola,2023,119,Africa,Ultra-budget phone with clean Android Go. Performance is very basic.,2,32,Cosmic Black
ORD1471,2024-10-08,Galaxy M54,Samsung,2023,399,Europe,Mid-range with large display and good camera. One UI Core is simplified.,8,128,Awesome Blue
ORD1472,2024-01-25,iPhone 12 mini,Apple,2020,529,Oceania,Compact iPhone with 5G support. Battery life is the main weakness.,4,64,Blue
ORD1473,2024-09-13,Pixel 5a,Google,2021,449,South America,Mid-range Pixel with excellent camera. Stock Android experience is clean.,6,128,Mostly Black
ORD1474,2024-05-20,Redmi 10,Xiaomi,2021,159,North America,Budget phone with large battery. MIUI Lite reduces bloatware.,4,64,Carbon Gray
ORD1475,2024-11-07,OnePlus Nord 2T,OnePlus,2022,369,Asia,Good mid-range OnePlus with fast charging. OxygenOS is smooth.,8,128,Gray Shadow
ORD1476,2024-02-11,Vivo Y21,Vivo,2021,199,Africa,Budget phone with decent camera. FunTouch OS has simplified interface.,4,64,Diamond Glow
ORD1477,2024-08-29,Nothing Ear 1,Nothing,2021,99,Europe,Transparent earbuds with good sound quality. Design is unique.,0,0,White
ORD1478,2024-06-18,Galaxy A13,Samsung,2022,179,Oceania,Budget Samsung with basic One UI features. Performance is limited.,4,64,Awesome Blue
ORD1479,2024-04-12,iPhone SE 2,Apple,2020,399,South America,Compact iPhone with Touch ID. Performance is still excellent.,3,64,White
ORD1480,2024-12-20,Poco M4 Pro,Xiaomi,2022,249,North America,Budget phone with 5G support. MIUI optimization has improved.,6,128,Power Black
ORD1481,2024-07-15,Oppo A16,Oppo,2021,149,Asia,Basic smartphone with decent build. ColorOS Go is simplified.,3,32,Pearl Blue
ORD1482,2024-10-31,Honor 8X,Honor,2018,199,Africa,Older phone with good build quality. EMUI is dated but functional.,4,64,Midnight Black
ORD1483,2024-01-09,Realme C35,Realme,2022,129,Europe,Ultra-budget phone with basic camera. Realme UI Go is lighter.,4,64,Glowing Green
ORD1484,2024-09-04,Motorola Moto G42,Motorola,2022,199,Oceania,Budget phone with clean Android. Performance is adequate for daily use.,4,128,Atlantic Green
ORD1485,2024-05-26,Galaxy M33,Samsung,2022,279,South America,Mid-range with large battery. One UI Core features are basic.,6,128,Awesome Green
ORD1486,2024-08-06,iPhone 11 Pro,Apple,2019,899,North America,Pro iPhone with excellent camera system. Build quality remains premium.,4,64,Midnight Green
ORD1487,2024-11-19,Pixel 4a,Google,2020,349,Asia,Compact Pixel with great camera. Stock Android experience is clean.,6,128,Just Black
ORD1488,2024-03-04,Redmi 9,Xiaomi,2020,139,Africa,Budget phone with large display. MIUI Lite reduces bloatware.,3,32,Carbon Gray
ORD1489,2024-07-22,OnePlus 8T,OnePlus,2020,549,Europe,Fast flagship with excellent charging speed. OxygenOS is smooth.,8,128,Aquamarine Green
ORD1490,2024-12-12,Vivo Y20,Vivo,2020,169,Oceania,Budget phone with decent battery life. FunTouch OS is simplified.,4,64,Dawn White
ORD1491,2024-04-29,Nothing Ear Stick,Nothing,2022,99,South America,Lightweight earbuds with good sound. Design is minimalist.,0,0,White
ORD1492,2024-08-21,Galaxy A12,Samsung,2021,179,North America,Budget Samsung with basic features. One UI Core is simplified.,3,32,Awesome Blue
ORD1493,2024-06-05,iPhone XS,Apple,2018,699,Asia,Premium iPhone with excellent build quality. Performance remains strong.,4,64,Gold
ORD1494,2024-10-14,Poco X3 NFC,Xiaomi,2020,229,Africa,Gaming phone with excellent cooling. Performance per dollar is outstanding.,6,64,Shadow Gray
